{
  "schemaVersion": 1,
  "subject": "dsh-openwolf",
  "state": "unverified",
  "verifiedAt": "2026-08-17T00:00:00.000Z",
  "environment": {
    "os": "win32",
    "arch": "x64",
    "node": "v25.2.0",
    "dsh": "0.1.0-rc.6"
  },
  "checks": [
    {
      "id": "exact-artifact-integrity",
      "status": "passed",
      "detail": "npm tarball SHA-512 matched; archive inspected without executing package code"
    },
    {
      "id": "package-install",
      "status": "skipped",
      "detail": "hosted ephemeral runtime verification pending; prepare lifecycle must remain disabled"
    },
    {
      "id": "coding-workflow-smoke",
      "status": "skipped",
      "detail": "fixture repository map and bounded coding workflow not yet executed"
    }
  ],
  "evidence": [
    "registry/verifications/dsh-openwolf.json"
  ]
}
