{
  "schemaVersion": 1,
  "subject": "anionex--dsh-vision-toolkit",
  "state": "unverified",
  "checks": [
    {
      "id": "exact-artifact-integrity",
      "status": "passed"
    },
    {
      "id": "package-installation-flow",
      "status": "skipped",
      "detail": "previous GitHub-source failure does not apply to the exact prebuilt npm artifact; hosted ephemeral verification pending"
    },
    {
      "id": "ui-workflow-smoke",
      "status": "skipped",
      "detail": "fixture image and UI restoration workflow not yet executed"
    }
  ],
  "evidence": [
    "registry/verifications/anionex--dsh-vision-toolkit.json"
  ]
}
